20:17:34.856695 IP 192.168.0.149.6653 > 192.168.0.149.48692: Flags [P.], seq 2882779276:2882779356, ack 1668421614, win 6269, options [nop,nop,TS val 3204243 ecr 3203656], length 80: OpenFlow
	version 1.0, type FLOW_MOD, length 80, xid 0x000000db
20:17:34.857566 IP 192.168.0.149.6653 > 192.168.0.149.48692: Flags [P.], seq 80:88, ack 1, win 6269, options [nop,nop,TS val 3204243 ecr 3203656], length 8: OpenFlow
	version 1.0, type BARRIER_REQUEST, length 8, xid 0x000000db
20:17:34.857665 IP 192.168.0.149.48692 > 192.168.0.149.6653: Flags [.], ack 88, win 96, options [nop,nop,TS val 3204243 ecr 3204243], length 0
20:17:34.857691 IP 192.168.0.149.48692 > 192.168.0.149.6653: Flags [P.], seq 1:9, ack 88, win 96, options [nop,nop,TS val 3204243 ecr 3204243], length 8: OpenFlow
	version 1.0, type BARRIER_REPLY, length 8, xid 0x000000db
20:17:34.857702 IP 192.168.0.149.6653 > 192.168.0.149.48692: Flags [.], ack 9, win 6269, options [nop,nop,TS val 3204243 ecr 3204243], length 0
20:17:35.496744 IP 192.168.0.149.6653 > 192.168.0.149.48692: Flags [P.], seq 88:108, ack 9, win 6269, options [nop,nop,TS val 3204403 ecr 3204243], length 20: OpenFlow
	version 1.0, type STATS_REQUEST, length 20, xid 0x00000a30
20:17:35.497284 IP 192.168.0.149.48692 > 192.168.0.149.6653: Flags [P.], seq 9:333, ack 108, win 96, options [nop,nop,TS val 3204403 ecr 3204403], length 324: OpenFlow
	version 1.0, type STATS_REPLY, length 324, xid 0x00000a30
20:17:35.497302 IP 192.168.0.149.6653 > 192.168.0.149.48692: Flags [.], ack 333, win 6269, options [nop,nop,TS val 3204403 ecr 3204403], length 0
20:17:35.528176 IP 192.168.0.149.6653 > 192.168.0.149.48692: Flags [P.], seq 108:164, ack 333, win 6269, options [nop,nop,TS val 3204411 ecr 3204403], length 56: OpenFlow
	version 1.0, type STATS_REQUEST, length 56, xid 0x0000730b
20:17:35.528659 IP 192.168.0.149.48692 > 192.168.0.149.6653: Flags [P.], seq 333:633, ack 164, win 96, options [nop,nop,TS val 3204411 ecr 3204411], length 300: OpenFlow
	version 1.0, type STATS_REPLY, length 300, xid 0x0000730b
20:17:35.529269 IP 192.168.0.149.6653 > 192.168.0.149.48692: Flags [P.], seq 164:176, ack 633, win 6269, options [nop,nop,TS val 3204411 ecr 3204411], length 12: OpenFlow
	version 1.0, type STATS_REQUEST, length 12, xid 0x0000730c
20:17:35.529901 IP 192.168.0.149.48692 > 192.168.0.149.6653: Flags [P.], seq 633:16901, ack 176, win 96, options [nop,nop,TS val 3204411 ecr 3204411], length 16268: OpenFlow
	version 1.0, type STATS_REPLY, length 16268, xid 0x0000730c
20:17:35.567603 IP 192.168.0.149.6653 > 192.168.0.149.48692: Flags [.], ack 16901, win 6269, options [nop,nop,TS val 3204421 ecr 3204411], length 0
20:17:35.605005 IP 192.168.0.149.6653 > 192.168.0.149.48692: Flags [P.], seq 176:290, ack 16901, win 6269, options [nop,nop,TS val 3204430 ecr 3204411], length 114: OpenFlow
	version 1.0, type PACKET_OUT, length 114, xid 0x0000730f
20:17:35.605683 IP 192.168.0.149.6653 > 192.168.0.149.48692: Flags [P.], seq 290:404, ack 16901, win 6269, options [nop,nop,TS val 3204430 ecr 3204411], length 114: OpenFlow
	version 1.0, type PACKET_OUT, length 114, xid 0x00007310
20:17:35.605807 IP 192.168.0.149.48692 > 192.168.0.149.6653: Flags [.], ack 404, win 96, options [nop,nop,TS val 3204430 ecr 3204430], length 0
20:17:35.606073 IP 192.168.0.149.6653 > 192.168.0.149.48692: Flags [P.], seq 404:518, ack 16901, win 6269, options [nop,nop,TS val 3204430 ecr 3204430], length 114: OpenFlow
	version 1.0, type PACKET_OUT, length 114, xid 0x00007311
20:17:35.606464 IP 192.168.0.149.6653 > 192.168.0.149.48692: Flags [P.], seq 518:632, ack 16901, win 6269, options [nop,nop,TS val 3204430 ecr 3204430], length 114: OpenFlow
	version 1.0, type PACKET_OUT, length 114, xid 0x00007312
20:17:35.606597 IP 192.168.0.149.48692 > 192.168.0.149.6653: Flags [.], ack 632, win 96, options [nop,nop,TS val 3204430 ecr 3204430], length 0
20:17:35.887920 IP 192.168.0.149.6653 > 192.168.0.149.48692: Flags [P.], seq 632:712, ack 16901, win 6269, options [nop,nop,TS val 3204501 ecr 3204430], length 80: OpenFlow
	version 1.0, type FLOW_MOD, length 80, xid 0x000000dc
20:17:35.888529 IP 192.168.0.149.6653 > 192.168.0.149.48692: Flags [P.], seq 712:720, ack 16901, win 6269, options [nop,nop,TS val 3204501 ecr 3204430], length 8: OpenFlow
	version 1.0, type BARRIER_REQUEST, length 8, xid 0x000000dc
20:17:35.888613 IP 192.168.0.149.48692 > 192.168.0.149.6653: Flags [.], ack 720, win 96, options [nop,nop,TS val 3204501 ecr 3204501], length 0
20:17:35.888652 IP 192.168.0.149.48692 > 192.168.0.149.6653: Flags [P.], seq 16901:16909, ack 720, win 96, options [nop,nop,TS val 3204501 ecr 3204501], length 8: OpenFlow
	version 1.0, type BARRIER_REPLY, length 8, xid 0x000000dc
20:17:35.888664 IP 192.168.0.149.6653 > 192.168.0.149.48692: Flags [.], ack 16909, win 6269, options [nop,nop,TS val 3204501 ecr 3204501], length 0
20:17:36.908997 IP 192.168.0.149.6653 > 192.168.0.149.48692: Flags [P.], seq 720:800, ack 16909, win 6269, options [nop,nop,TS val 3204756 ecr 3204501], length 80: OpenFlow
	version 1.0, type FLOW_MOD, length 80, xid 0x000000dd
20:17:36.909823 IP 192.168.0.149.6653 > 192.168.0.149.48692: Flags [P.], seq 800:808, ack 16909, win 6269, options [nop,nop,TS val 3204756 ecr 3204501], length 8: OpenFlow
	version 1.0, type BARRIER_REQUEST, length 8, xid 0x000000dd
20:17:36.909927 IP 192.168.0.149.48692 > 192.168.0.149.6653: Flags [.], ack 808, win 96, options [nop,nop,TS val 3204756 ecr 3204756], length 0
20:17:36.909955 IP 192.168.0.149.48692 > 192.168.0.149.6653: Flags [P.], seq 16909:16917, ack 808, win 96, options [nop,nop,TS val 3204756 ecr 3204756], length 8: OpenFlow
	version 1.0, type BARRIER_REPLY, length 8, xid 0x000000dd
20:17:36.909966 IP 192.168.0.149.6653 > 192.168.0.149.48692: Flags [.], ack 16917, win 6269, options [nop,nop,TS val 3204756 ecr 3204756], length 0
20:17:36.940982 IP 192.168.0.149.6653 > 192.168.0.149.48692: Flags [P.], seq 808:888, ack 16917, win 6269, options [nop,nop,TS val 3204764 ecr 3204756], length 80: OpenFlow
	version 1.0, type FLOW_MOD, length 80, xid 0x000000de
20:17:36.941720 IP 192.168.0.149.6653 > 192.168.0.149.48692: Flags [P.], seq 888:896, ack 16917, win 6269, options [nop,nop,TS val 3204764 ecr 3204756], length 8: OpenFlow
	version 1.0, type BARRIER_REQUEST, length 8, xid 0x000000de
20:17:36.941846 IP 192.168.0.149.48692 > 192.168.0.149.6653: Flags [.], ack 896, win 96, options [nop,nop,TS val 3204764 ecr 3204764], length 0
20:17:36.941887 IP 192.168.0.149.48692 > 192.168.0.149.6653: Flags [P.], seq 16917:16925, ack 896, win 96, options [nop,nop,TS val 3204764 ecr 3204764], length 8: OpenFlow
	version 1.0, type BARRIER_REPLY, length 8, xid 0x000000de
20:17:36.979680 IP 192.168.0.149.6653 > 192.168.0.149.48692: Flags [.], ack 16925, win 6269, options [nop,nop,TS val 3204774 ecr 3204764], length 0
20:17:37.971191 IP 192.168.0.149.6653 > 192.168.0.149.48692: Flags [P.], seq 896:976, ack 16925, win 6269, options [nop,nop,TS val 3205021 ecr 3204764], length 80: OpenFlow
	version 1.0, type FLOW_MOD, length 80, xid 0x000000df
20:17:37.972015 IP 192.168.0.149.6653 > 192.168.0.149.48692: Flags [P.], seq 976:984, ack 16925, win 6269, options [nop,nop,TS val 3205022 ecr 3204764], length 8: OpenFlow
	version 1.0, type BARRIER_REQUEST, length 8, xid 0x000000df
20:17:37.972118 IP 192.168.0.149.48692 > 192.168.0.149.6653: Flags [.], ack 984, win 96, options [nop,nop,TS val 3205022 ecr 3205021], length 0
20:17:37.972147 IP 192.168.0.149.48692 > 192.168.0.149.6653: Flags [P.], seq 16925:16933, ack 984, win 96, options [nop,nop,TS val 3205022 ecr 3205021], length 8: OpenFlow
	version 1.0, type BARRIER_REPLY, length 8, xid 0x000000df
20:17:37.972160 IP 192.168.0.149.6653 > 192.168.0.149.48692: Flags [.], ack 16933, win 6269, options [nop,nop,TS val 3205022 ecr 3205022], length 0
20:17:38.705600 IP 192.168.0.149.6653 > 192.168.0.149.48692: Flags [P.], seq 984:1098, ack 16933, win 6269, options [nop,nop,TS val 3205205 ecr 3205022], length 114: OpenFlow
	version 1.0, type PACKET_OUT, length 114, xid 0x0000731b
20:17:38.706535 IP 192.168.0.149.6653 > 192.168.0.149.48692: Flags [P.], seq 1098:1212, ack 16933, win 6269, options [nop,nop,TS val 3205205 ecr 3205022], length 114: OpenFlow
	version 1.0, type PACKET_OUT, length 114, xid 0x0000731c
20:17:38.706659 IP 192.168.0.149.48692 > 192.168.0.149.6653: Flags [.], ack 1212, win 96, options [nop,nop,TS val 3205205 ecr 3205205], length 0
20:17:38.707358 IP 192.168.0.149.6653 > 192.168.0.149.48692: Flags [P.], seq 1212:1326, ack 16933, win 6269, options [nop,nop,TS val 3205205 ecr 3205205], length 114: OpenFlow
	version 1.0, type PACKET_OUT, length 114, xid 0x0000731d
20:17:38.708494 IP 192.168.0.149.6653 > 192.168.0.149.48692: Flags [P.], seq 1326:1440, ack 16933, win 6269, options [nop,nop,TS val 3205206 ecr 3205205], length 114: OpenFlow
	version 1.0, type PACKET_OUT, length 114, xid 0x0000731e
20:17:38.708659 IP 192.168.0.149.48692 > 192.168.0.149.6653: Flags [.], ack 1440, win 96, options [nop,nop,TS val 3205206 ecr 3205205], length 0
20:17:38.996167 IP 192.168.0.149.6653 > 192.168.0.149.48692: Flags [P.], seq 1440:1520, ack 16933, win 6269, options [nop,nop,TS val 3205278 ecr 3205206], length 80: OpenFlow
	version 1.0, type FLOW_MOD, length 80, xid 0x000000e0
20:17:38.997077 IP 192.168.0.149.6653 > 192.168.0.149.48692: Flags [P.], seq 1520:1528, ack 16933, win 6269, options [nop,nop,TS val 3205278 ecr 3205206], length 8: OpenFlow
	version 1.0, type BARRIER_REQUEST, length 8, xid 0x000000e0
20:17:38.997312 IP 192.168.0.149.48692 > 192.168.0.149.6653: Flags [.], ack 1528, win 96, options [nop,nop,TS val 3205278 ecr 3205278], length 0
20:17:38.997360 IP 192.168.0.149.48692 > 192.168.0.149.6653: Flags [P.], seq 16933:16941, ack 1528, win 96, options [nop,nop,TS val 3205278 ecr 3205278], length 8: OpenFlow
	version 1.0, type BARRIER_REPLY, length 8, xid 0x000000e0
20:17:38.997372 IP 192.168.0.149.6653 > 192.168.0.149.48692: Flags [.], ack 16941, win 6269, options [nop,nop,TS val 3205278 ecr 3205278], length 0
20:17:39.022782 IP 192.168.0.149.6653 > 192.168.0.149.48692: Flags [P.], seq 1528:1608, ack 16941, win 6269, options [nop,nop,TS val 3205284 ecr 3205278], length 80: OpenFlow
	version 1.0, type FLOW_MOD, length 80, xid 0x000000e1
20:17:39.026266 IP 192.168.0.149.6653 > 192.168.0.149.48692: Flags [P.], seq 1608:1616, ack 16941, win 6269, options [nop,nop,TS val 3205285 ecr 3205278], length 8: OpenFlow
	version 1.0, type BARRIER_REQUEST, length 8, xid 0x000000e1
20:17:39.026506 IP 192.168.0.149.48692 > 192.168.0.149.6653: Flags [.], ack 1616, win 96, options [nop,nop,TS val 3205285 ecr 3205284], length 0
20:17:39.026551 IP 192.168.0.149.48692 > 192.168.0.149.6653: Flags [P.], seq 16941:16949, ack 1616, win 96, options [nop,nop,TS val 3205285 ecr 3205284], length 8: OpenFlow
	version 1.0, type BARRIER_REPLY, length 8, xid 0x000000e1
20:17:39.063372 IP 192.168.0.149.6653 > 192.168.0.149.48692: Flags [.], ack 16949, win 6269, options [nop,nop,TS val 3205295 ecr 3205285], length 0
20:17:40.050302 IP 192.168.0.149.6653 > 192.168.0.149.48692: Flags [P.], seq 1616:1696, ack 16949, win 6269, options [nop,nop,TS val 3205541 ecr 3205285], length 80: OpenFlow
	version 1.0, type FLOW_MOD, length 80, xid 0x000000e2
20:17:40.051054 IP 192.168.0.149.6653 > 192.168.0.149.48692: Flags [P.], seq 1696:1704, ack 16949, win 6269, options [nop,nop,TS val 3205541 ecr 3205285], length 8: OpenFlow
	version 1.0, type BARRIER_REQUEST, length 8, xid 0x000000e2
20:17:40.051139 IP 192.168.0.149.48692 > 192.168.0.149.6653: Flags [.], ack 1704, win 96, options [nop,nop,TS val 3205541 ecr 3205541], length 0
20:17:40.051178 IP 192.168.0.149.48692 > 192.168.0.149.6653: Flags [P.], seq 16949:16957, ack 1704, win 96, options [nop,nop,TS val 3205541 ecr 3205541], length 8: OpenFlow
	version 1.0, type BARRIER_REPLY, length 8, xid 0x000000e2
20:17:40.051189 IP 192.168.0.149.6653 > 192.168.0.149.48692: Flags [.], ack 16957, win 6269, options [nop,nop,TS val 3205541 ecr 3205541], length 0
20:17:40.496439 IP 192.168.0.149.6653 > 192.168.0.149.48692: Flags [P.], seq 1704:1724, ack 16957, win 6269, options [nop,nop,TS val 3205653 ecr 3205541], length 20: OpenFlow
	version 1.0, type STATS_REQUEST, length 20, xid 0x00000a31
20:17:40.496805 IP 192.168.0.149.48692 > 192.168.0.149.6653: Flags [P.], seq 16957:17281, ack 1724, win 96, options [nop,nop,TS val 3205653 ecr 3205653], length 324: OpenFlow
	version 1.0, type STATS_REPLY, length 324, xid 0x00000a31
20:17:40.496826 IP 192.168.0.149.6653 > 192.168.0.149.48692: Flags [.], ack 17281, win 6269, options [nop,nop,TS val 3205653 ecr 3205653], length 0
20:17:40.528616 IP 192.168.0.149.6653 > 192.168.0.149.48692: Flags [P.], seq 1724:1780, ack 17281, win 6269, options [nop,nop,TS val 3205661 ecr 3205653], length 56: OpenFlow
	version 1.0, type STATS_REQUEST, length 56, xid 0x00007326
20:17:40.528873 IP 192.168.0.149.48692 > 192.168.0.149.6653: Flags [P.], seq 17281:17773, ack 1780, win 96, options [nop,nop,TS val 3205661 ecr 3205661], length 492: OpenFlow
	version 1.0, type STATS_REPLY, length 492, xid 0x00007326
20:17:40.532468 IP 192.168.0.149.6653 > 192.168.0.149.48692: Flags [P.], seq 1780:1852, ack 17773, win 6269, options [nop,nop,TS val 3205662 ecr 3205661], length 72: OpenFlow
	version 1.0, type FLOW_MOD, length 72, xid 0x000000e3
20:17:40.532764 IP 192.168.0.149.48692 > 192.168.0.149.6653: Flags [P.], seq 17773:17861, ack 1852, win 96, options [nop,nop,TS val 3205662 ecr 3205662], length 88: OpenFlow
	version 1.0, type FLOW_REMOVED, length 88, xid 0x00000000
20:17:40.532798 IP 192.168.0.149.48692 > 192.168.0.149.6653: Flags [P.], seq 17861:17949, ack 1852, win 96, options [nop,nop,TS val 3205662 ecr 3205662], length 88: OpenFlow
	version 1.0, type FLOW_REMOVED, length 88, xid 0x00000000
20:17:40.532820 IP 192.168.0.149.48692 > 192.168.0.149.6653: Flags [P.], seq 17949:18037, ack 1852, win 96, options [nop,nop,TS val 3205662 ecr 3205662], length 88: OpenFlow
	version 1.0, type FLOW_REMOVED, length 88, xid 0x00000000
20:17:40.533164 IP 192.168.0.149.6653 > 192.168.0.149.48692: Flags [P.], seq 1852:1860, ack 18037, win 6269, options [nop,nop,TS val 3205662 ecr 3205662], length 8: OpenFlow
	version 1.0, type BARRIER_REQUEST, length 8, xid 0x000000e3
20:17:40.533250 IP 192.168.0.149.48692 > 192.168.0.149.6653: Flags [P.], seq 18037:18045, ack 1860, win 96, options [nop,nop,TS val 3205662 ecr 3205662], length 8: OpenFlow
	version 1.0, type BARRIER_REPLY, length 8, xid 0x000000e3
20:17:40.533448 IP 192.168.0.149.6653 > 192.168.0.149.48692: Flags [P.], seq 1860:1932, ack 18045, win 6269, options [nop,nop,TS val 3205662 ecr 3205662], length 72: OpenFlow
	version 1.0, type FLOW_MOD, length 72, xid 0x000000e5
20:17:40.534119 IP 192.168.0.149.6653 > 192.168.0.149.48692: Flags [P.], seq 1932:1940, ack 18045, win 6269, options [nop,nop,TS val 3205662 ecr 3205662], length 8: OpenFlow
	version 1.0, type BARRIER_REQUEST, length 8, xid 0x000000e5
20:17:40.534250 IP 192.168.0.149.48692 > 192.168.0.149.6653: Flags [.], ack 1940, win 96, options [nop,nop,TS val 3205662 ecr 3205662], length 0
20:17:40.534276 IP 192.168.0.149.48692 > 192.168.0.149.6653: Flags [P.], seq 18045:18053, ack 1940, win 96, options [nop,nop,TS val 3205662 ecr 3205662], length 8: OpenFlow
	version 1.0, type BARRIER_REPLY, length 8, xid 0x000000e5
20:17:40.534433 IP 192.168.0.149.6653 > 192.168.0.149.48692: Flags [P.], seq 1940:1952, ack 18053, win 6269, options [nop,nop,TS val 3205662 ecr 3205662], length 12: OpenFlow
	version 1.0, type STATS_REQUEST, length 12, xid 0x0000732c
20:17:40.534704 IP 192.168.0.149.48692 > 192.168.0.149.6653: Flags [P.], seq 18053:34321, ack 1952, win 96, options [nop,nop,TS val 3205662 ecr 3205662], length 16268: OpenFlow
	version 1.0, type STATS_REPLY, length 16268, xid 0x0000732c
20:17:40.535064 IP 192.168.0.149.6653 > 192.168.0.149.48692: Flags [P.], seq 1952:2024, ack 34321, win 6246, options [nop,nop,TS val 3205662 ecr 3205662], length 72: OpenFlow
	version 1.0, type FLOW_MOD, length 72, xid 0x000000e4
20:17:40.535306 IP 192.168.0.149.6653 > 192.168.0.149.48692: Flags [P.], seq 2024:2032, ack 34321, win 6246, options [nop,nop,TS val 3205662 ecr 3205662], length 8: OpenFlow
	version 1.0, type BARRIER_REQUEST, length 8, xid 0x000000e4
20:17:40.535371 IP 192.168.0.149.48692 > 192.168.0.149.6653: Flags [.], ack 2032, win 96, options [nop,nop,TS val 3205662 ecr 3205662], length 0
20:17:40.535392 IP 192.168.0.149.48692 > 192.168.0.149.6653: Flags [P.], seq 34321:34329, ack 2032, win 96, options [nop,nop,TS val 3205662 ecr 3205662], length 8: OpenFlow
	version 1.0, type BARRIER_REPLY, length 8, xid 0x000000e4
20:17:40.571861 IP 192.168.0.149.6653 > 192.168.0.149.48692: Flags [.], ack 34329, win 6269, options [nop,nop,TS val 3205672 ecr 3205662], length 0
20:17:41.079725 IP 192.168.0.149.6653 > 192.168.0.149.48692: Flags [P.], seq 2032:2112, ack 34329, win 6269, options [nop,nop,TS val 3205799 ecr 3205662], length 80: OpenFlow
	version 1.0, type FLOW_MOD, length 80, xid 0x000000e6
20:17:41.080946 IP 192.168.0.149.6653 > 192.168.0.149.48692: Flags [P.], seq 2112:2120, ack 34329, win 6269, options [nop,nop,TS val 3205799 ecr 3205662], length 8: OpenFlow
	version 1.0, type BARRIER_REQUEST, length 8, xid 0x000000e6
20:17:41.081087 IP 192.168.0.149.48692 > 192.168.0.149.6653: Flags [.], ack 2120, win 96, options [nop,nop,TS val 3205799 ecr 3205799], length 0
20:17:41.081135 IP 192.168.0.149.48692 > 192.168.0.149.6653: Flags [P.], seq 34329:34337, ack 2120, win 96, options [nop,nop,TS val 3205799 ecr 3205799], length 8: OpenFlow
	version 1.0, type BARRIER_REPLY, length 8, xid 0x000000e6
20:17:41.081148 IP 192.168.0.149.6653 > 192.168.0.149.48692: Flags [.], ack 34337, win 6269, options [nop,nop,TS val 3205799 ecr 3205799], length 0
20:17:41.111511 IP 192.168.0.149.6653 > 192.168.0.149.48692: Flags [P.], seq 2120:2200, ack 34337, win 6269, options [nop,nop,TS val 3205807 ecr 3205799], length 80: OpenFlow
	version 1.0, type FLOW_MOD, length 80, xid 0x000000e7
20:17:41.112358 IP 192.168.0.149.6653 > 192.168.0.149.48692: Flags [P.], seq 2200:2208, ack 34337, win 6269, options [nop,nop,TS val 3205807 ecr 3205799], length 8: OpenFlow
	version 1.0, type BARRIER_REQUEST, length 8, xid 0x000000e7
20:17:41.112475 IP 192.168.0.149.48692 > 192.168.0.149.6653: Flags [.], ack 2208, win 96, options [nop,nop,TS val 3205807 ecr 3205807], length 0
20:17:41.112507 IP 192.168.0.149.48692 > 192.168.0.149.6653: Flags [P.], seq 34337:34345, ack 2208, win 96, options [nop,nop,TS val 3205807 ecr 3205807], length 8: OpenFlow
	version 1.0, type BARRIER_REPLY, length 8, xid 0x000000e7
20:17:41.151417 IP 192.168.0.149.6653 > 192.168.0.149.48692: Flags [.], ack 34345, win 6269, options [nop,nop,TS val 3205817 ecr 3205807], length 0
20:17:41.812446 IP 192.168.0.149.6653 > 192.168.0.149.48692: Flags [P.], seq 2208:2322, ack 34345, win 6269, options [nop,nop,TS val 3205982 ecr 3205807], length 114: OpenFlow
	version 1.0, type PACKET_OUT, length 114, xid 0x00007334
20:17:41.813308 IP 192.168.0.149.6653 > 192.168.0.149.48692: Flags [P.], seq 2322:2436, ack 34345, win 6269, options [nop,nop,TS val 3205982 ecr 3205807], length 114: OpenFlow
	version 1.0, type PACKET_OUT, length 114, xid 0x00007335
20:17:41.813495 IP 192.168.0.149.48692 > 192.168.0.149.6653: Flags [.], ack 2436, win 96, options [nop,nop,TS val 3205982 ecr 3205982], length 0
20:17:41.813801 IP 192.168.0.149.6653 > 192.168.0.149.48692: Flags [P.], seq 2436:2550, ack 34345, win 6269, options [nop,nop,TS val 3205982 ecr 3205982], length 114: OpenFlow
	version 1.0, type PACKET_OUT, length 114, xid 0x00007336
20:17:41.814060 IP 192.168.0.149.6653 > 192.168.0.149.48692: Flags [P.], seq 2550:2664, ack 34345, win 6269, options [nop,nop,TS val 3205982 ecr 3205982], length 114: OpenFlow
	version 1.0, type PACKET_OUT, length 114, xid 0x00007337
20:17:41.814137 IP 192.168.0.149.48692 > 192.168.0.149.6653: Flags [.], ack 2664, win 96, options [nop,nop,TS val 3205982 ecr 3205982], length 0

