20:17:34.856695 IP 192.168.0.149.6653 > 192.168.0.149.48692: Flags [P.], seq 2882779276:2882779356, ack 1668421614, win 6269, options [nop,nop,TS val 3204243 ecr 3203656], length 80: OpenFlow
	version 1.0, type FLOW_MOD, length 80, xid 0x000000db
20:17:34.857566 IP 192.168.0.149.6653 > 192.168.0.149.48692: Flags [P.], seq 80:88, ack 1, win 6269, options [nop,nop,TS val 3204243 ecr 3203656], length 8: OpenFlow
	version 1.0, type FLOW_MOD, length 80, xid 0x000000dc
20:17:35.888529 IP 192.168.0.149.6653 > 192.168.0.149.48692: Flags [P.], seq 712:720, ack 16901, win 6269, options [nop,nop,TS val 3204501 ecr 3204430], length 8: OpenFlow
	version 1.0, type FLOW_MOD, length 80, xid 0x000000dd
20:17:36.909823 IP 192.168.0.149.6653 > 192.168.0.149.48692: Flags [P.], seq 800:808, ack 16909, win 6269, options [nop,nop,TS val 3204756 ecr 3204501], length 8: OpenFlow
	version 1.0, type FLOW_MOD, length 80, xid 0x000000de
20:17:36.941720 IP 192.168.0.149.6653 > 192.168.0.149.48692: Flags [P.], seq 888:896, ack 16917, win 6269, options [nop,nop,TS val 3204764 ecr 3204756], length 8: OpenFlow
	version 1.0, type FLOW_MOD, length 80, xid 0x000000df
20:17:37.972015 IP 192.168.0.149.6653 > 192.168.0.149.48692: Flags [P.], seq 976:984, ack 16925, win 6269, options [nop,nop,TS val 3205022 ecr 3204764], length 8: OpenFlow
	version 1.0, type FLOW_MOD, length 80, xid 0x000000e0
20:17:38.997077 IP 192.168.0.149.6653 > 192.168.0.149.48692: Flags [P.], seq 1520:1528, ack 16933, win 6269, options [nop,nop,TS val 3205278 ecr 3205206], length 8: OpenFlow
	version 1.0, type FLOW_MOD, length 80, xid 0x000000e1
20:17:39.026266 IP 192.168.0.149.6653 > 192.168.0.149.48692: Flags [P.], seq 1608:1616, ack 16941, win 6269, options [nop,nop,TS val 3205285 ecr 3205278], length 8: OpenFlow
	version 1.0, type FLOW_MOD, length 80, xid 0x000000e2
20:17:40.051054 IP 192.168.0.149.6653 > 192.168.0.149.48692: Flags [P.], seq 1696:1704, ack 16949, win 6269, options [nop,nop,TS val 3205541 ecr 3205285], length 8: OpenFlow
	version 1.0, type FLOW_MOD, length 72, xid 0x000000e3
20:17:40.532764 IP 192.168.0.149.48692 > 192.168.0.149.6653: Flags [P.], seq 17773:17861, ack 1852, win 96, options [nop,nop,TS val 3205662 ecr 3205662], length 88: OpenFlow
	version 1.0, type FLOW_REMOVED, length 88, xid 0x00000000
20:17:40.532798 IP 192.168.0.149.48692 > 192.168.0.149.6653: Flags [P.], seq 17861:17949, ack 1852, win 96, options [nop,nop,TS val 3205662 ecr 3205662], length 88: OpenFlow
	version 1.0, type FLOW_REMOVED, length 88, xid 0x00000000
20:17:40.532820 IP 192.168.0.149.48692 > 192.168.0.149.6653: Flags [P.], seq 17949:18037, ack 1852, win 96, options [nop,nop,TS val 3205662 ecr 3205662], length 88: OpenFlow
	version 1.0, type FLOW_REMOVED, length 88, xid 0x00000000
20:17:40.533164 IP 192.168.0.149.6653 > 192.168.0.149.48692: Flags [P.], seq 1852:1860, ack 18037, win 6269, options [nop,nop,TS val 3205662 ecr 3205662], length 8: OpenFlow
	version 1.0, type FLOW_MOD, length 72, xid 0x000000e5
20:17:40.534119 IP 192.168.0.149.6653 > 192.168.0.149.48692: Flags [P.], seq 1932:1940, ack 18045, win 6269, options [nop,nop,TS val 3205662 ecr 3205662], length 8: OpenFlow
	version 1.0, type FLOW_MOD, length 72, xid 0x000000e4
20:17:40.535306 IP 192.168.0.149.6653 > 192.168.0.149.48692: Flags [P.], seq 2024:2032, ack 34321, win 6246, options [nop,nop,TS val 3205662 ecr 3205662], length 8: OpenFlow
	version 1.0, type FLOW_MOD, length 80, xid 0x000000e6
20:17:41.080946 IP 192.168.0.149.6653 > 192.168.0.149.48692: Flags [P.], seq 2112:2120, ack 34329, win 6269, options [nop,nop,TS val 3205799 ecr 3205662], length 8: OpenFlow
	version 1.0, type FLOW_MOD, length 80, xid 0x000000e7
20:17:41.112358 IP 192.168.0.149.6653 > 192.168.0.149.48692: Flags [P.], seq 2200:2208, ack 34337, win 6269, options [nop,nop,TS val 3205807 ecr 3205799], length 8: OpenFlow
