	version 1.0, type FLOW_MOD, length 80, xid 0x000000bd
20:16:25.154085 IP 192.168.0.149.6653 > 192.168.0.149.48692: Flags [P.], seq 536:544, ack 1, win 6269, options [nop,nop,TS val 3186817 ecr 3186606], length 8: OpenFlow
	version 1.0, type FLOW_MOD, length 80, xid 0x000000be
20:16:26.179203 IP 192.168.0.149.6653 > 192.168.0.149.48692: Flags [P.], seq 712:720, ack 16901, win 6269, options [nop,nop,TS val 3187073 ecr 3186911], length 8: OpenFlow
	version 1.0, type FLOW_MOD, length 80, xid 0x000000bf
20:16:27.217225 IP 192.168.0.149.6653 > 192.168.0.149.48692: Flags [P.], seq 800:808, ack 16909, win 6269, options [nop,nop,TS val 3187333 ecr 3187074], length 8: OpenFlow
	version 1.0, type FLOW_MOD, length 80, xid 0x000000c0
20:16:27.250766 IP 192.168.0.149.6653 > 192.168.0.149.48692: Flags [P.], seq 888:896, ack 16917, win 6269, options [nop,nop,TS val 3187341 ecr 3187333], length 8: OpenFlow
	version 1.0, type FLOW_MOD, length 80, xid 0x000000c1
20:16:28.288394 IP 192.168.0.149.6653 > 192.168.0.149.48692: Flags [P.], seq 1432:1440, ack 16925, win 6269, options [nop,nop,TS val 3187601 ecr 3187380], length 8: OpenFlow
	version 1.0, type FLOW_MOD, length 80, xid 0x000000c2
20:16:29.336870 IP 192.168.0.149.6653 > 192.168.0.149.48692: Flags [P.], seq 1520:1528, ack 16933, win 6269, options [nop,nop,TS val 3187863 ecr 3187601], length 8: OpenFlow
	version 1.0, type FLOW_MOD, length 80, xid 0x000000c3
20:16:29.373545 IP 192.168.0.149.6653 > 192.168.0.149.48692: Flags [P.], seq 1608:1616, ack 16941, win 6269, options [nop,nop,TS val 3187872 ecr 3187863], length 8: OpenFlow
	version 1.0, type FLOW_MOD, length 80, xid 0x000000c4
20:16:30.406522 IP 192.168.0.149.6653 > 192.168.0.149.48692: Flags [P.], seq 1696:1704, ack 16949, win 6269, options [nop,nop,TS val 3188130 ecr 3187872], length 8: OpenFlow
	version 1.0, type FLOW_MOD, length 72, xid 0x000000c5
20:16:30.533843 IP 192.168.0.149.48692 > 192.168.0.149.6653: Flags [P.], seq 34041:34129, ack 2320, win 96, options [nop,nop,TS val 3188162 ecr 3188162], length 88: OpenFlow
	version 1.0, type FLOW_REMOVED, length 88, xid 0x00000000
20:16:30.533884 IP 192.168.0.149.48692 > 192.168.0.149.6653: Flags [P.], seq 34129:34217, ack 2320, win 96, options [nop,nop,TS val 3188162 ecr 3188162], length 88: OpenFlow
	version 1.0, type FLOW_REMOVED, length 88, xid 0x00000000
20:16:30.533913 IP 192.168.0.149.48692 > 192.168.0.149.6653: Flags [P.], seq 34217:34305, ack 2320, win 96, options [nop,nop,TS val 3188162 ecr 3188162], length 88: OpenFlow
	version 1.0, type FLOW_REMOVED, length 88, xid 0x00000000
20:16:30.534242 IP 192.168.0.149.6653 > 192.168.0.149.48692: Flags [P.], seq 2320:2328, ack 34305, win 6252, options [nop,nop,TS val 3188162 ecr 3188162], length 8: OpenFlow
	version 1.0, type FLOW_MOD, length 72, xid 0x000000c7
20:16:30.534899 IP 192.168.0.149.6653 > 192.168.0.149.48692: Flags [P.], seq 2400:2408, ack 34313, win 6252, options [nop,nop,TS val 3188162 ecr 3188162], length 8: OpenFlow
	version 1.0, type FLOW_MOD, length 72, xid 0x000000c6
20:16:30.535907 IP 192.168.0.149.6653 > 192.168.0.149.48692: Flags [P.], seq 2480:2488, ack 34321, win 6252, options [nop,nop,TS val 3188163 ecr 3188162], length 8: OpenFlow
	version 1.0, type FLOW_MOD, length 80, xid 0x000000c8
20:16:31.434937 IP 192.168.0.149.6653 > 192.168.0.149.48692: Flags [P.], seq 2568:2576, ack 34329, win 6269, options [nop,nop,TS val 3188387 ecr 3188163], length 8: OpenFlow
	version 1.0, type FLOW_MOD, length 80, xid 0x000000c9
20:16:31.461423 IP 192.168.0.149.6653 > 192.168.0.149.48692: Flags [P.], seq 2656:2664, ack 34337, win 6269, options [nop,nop,TS val 3188394 ecr 3188387], length 8: OpenFlow
	version 1.0, type FLOW_MOD, length 72, xid 0x000000ca
20:16:35.536144 IP 192.168.0.149.48692 > 192.168.0.149.6653: Flags [P.], seq 51333:51421, ack 3280, win 96, options [nop,nop,TS val 3189413 ecr 3189413], length 88: OpenFlow
	version 1.0, type FLOW_REMOVED, length 88, xid 0x00000000
20:16:35.536169 IP 192.168.0.149.48692 > 192.168.0.149.6653: Flags [P.], seq 51421:51509, ack 3280, win 96, options [nop,nop,TS val 3189413 ecr 3189413], length 88: OpenFlow
	version 1.0, type FLOW_REMOVED, length 88, xid 0x00000000
20:16:35.536518 IP 192.168.0.149.6653 > 192.168.0.149.48692: Flags [P.], seq 3280:3288, ack 51509, win 6269, options [nop,nop,TS val 3189413 ecr 3189413], length 8: OpenFlow
	version 1.0, type FLOW_MOD, length 80, xid 0x00000000
20:16:35.579447 IP 192.168.0.149.48692 > 192.168.0.149.6653: Flags [.], ack 3368, win 96, options [nop,nop,TS val 3189424 ecr 3189414], length 0
20:16:36.705324 IP 192.168.0.149.6653 > 192.168.0.149.48692: Flags [P.], seq 3368:3482, ack 51517, win 6269, options [nop,nop,TS val 3189705 ecr 3189424], length 114: OpenFlow
