	version 1.0, type FLOW_MOD, length 80, xid 0x000000af
20:15:36.514924 IP 192.168.0.149.6653 > 192.168.0.149.48692: Flags [P.], seq 168:176, ack 16797, win 6269, options [nop,nop,TS val 3174657 ecr 3174411], length 8: OpenFlow
	version 1.0, type FLOW_MOD, length 80, xid 0x000000b0
20:15:37.545729 IP 192.168.0.149.6653 > 192.168.0.149.48692: Flags [P.], seq 256:264, ack 16805, win 6269, options [nop,nop,TS val 3174915 ecr 3174657], length 8: OpenFlow
	version 1.0, type FLOW_MOD, length 80, xid 0x000000b1
20:15:38.585816 IP 192.168.0.149.6653 > 192.168.0.149.48692: Flags [P.], seq 800:808, ack 16813, win 6269, options [nop,nop,TS val 3175175 ecr 3174981], length 8: OpenFlow
	version 1.0, type FLOW_MOD, length 80, xid 0x000000b2
20:15:38.633464 IP 192.168.0.149.6653 > 192.168.0.149.48692: Flags [P.], seq 888:896, ack 16821, win 6269, options [nop,nop,TS val 3175187 ecr 3175175], length 8: OpenFlow
	version 1.0, type FLOW_MOD, length 80, xid 0x000000b3
20:15:39.665176 IP 192.168.0.149.6653 > 192.168.0.149.48692: Flags [P.], seq 976:984, ack 16829, win 6269, options [nop,nop,TS val 3175445 ecr 3175187], length 8: OpenFlow
	version 1.0, type FLOW_MOD, length 72, xid 0x000000b4
20:15:40.531573 IP 192.168.0.149.48692 > 192.168.0.149.6653: Flags [P.], seq 17557:17645, ack 1132, win 96, options [nop,nop,TS val 3175662 ecr 3175661], length 88: OpenFlow
	version 1.0, type FLOW_REMOVED, length 88, xid 0x00000000
20:15:40.531613 IP 192.168.0.149.48692 > 192.168.0.149.6653: Flags [P.], seq 17645:17733, ack 1132, win 96, options [nop,nop,TS val 3175662 ecr 3175661], length 88: OpenFlow
	version 1.0, type FLOW_REMOVED, length 88, xid 0x00000000
20:15:40.532056 IP 192.168.0.149.6653 > 192.168.0.149.48692: Flags [P.], seq 1132:1140, ack 17733, win 6269, options [nop,nop,TS val 3175662 ecr 3175662], length 8: OpenFlow
	version 1.0, type FLOW_MOD, length 80, xid 0x00000000
20:15:40.579468 IP 192.168.0.149.48692 > 192.168.0.149.6653: Flags [.], ack 1232, win 96, options [nop,nop,TS val 3175674 ecr 3175664], length 0
20:15:40.689356 IP 192.168.0.149.6653 > 192.168.0.149.48692: Flags [P.], seq 1232:1312, ack 34009, win 6269, options [nop,nop,TS val 3175701 ecr 3175674], length 80: OpenFlow
	version 1.0, type FLOW_MOD, length 80, xid 0x000000b5
20:15:40.689382 IP 192.168.0.149.48692 > 192.168.0.149.6653: Flags [.], ack 1312, win 96, options [nop,nop,TS val 3175701 ecr 3175701], length 0
20:15:40.690070 IP 192.168.0.149.6653 > 192.168.0.149.48692: Flags [P.], seq 1312:1320, ack 34009, win 6269, options [nop,nop,TS val 3175701 ecr 3175701], length 8: OpenFlow
	version 1.0, type FLOW_MOD, length 80, xid 0x000000b6
20:15:40.832446 IP 192.168.0.149.6653 > 192.168.0.149.48692: Flags [P.], seq 1400:1408, ack 34017, win 6269, options [nop,nop,TS val 3175737 ecr 3175701], length 8: OpenFlow
	version 1.0, type FLOW_MOD, length 80, xid 0x000000b7
20:15:41.862048 IP 192.168.0.149.6653 > 192.168.0.149.48692: Flags [P.], seq 1944:1952, ack 34025, win 6269, options [nop,nop,TS val 3175994 ecr 3175755], length 8: OpenFlow
	version 1.0, type FLOW_MOD, length 80, xid 0x000000b8
20:15:42.881760 IP 192.168.0.149.6653 > 192.168.0.149.48692: Flags [P.], seq 2032:2040, ack 34033, win 6269, options [nop,nop,TS val 3176249 ecr 3175994], length 8: OpenFlow
	version 1.0, type FLOW_MOD, length 80, xid 0x000000b9
20:15:42.907907 IP 192.168.0.149.6653 > 192.168.0.149.48692: Flags [P.], seq 2120:2128, ack 34041, win 6269, options [nop,nop,TS val 3176256 ecr 3176249], length 8: OpenFlow
	version 1.0, type FLOW_MOD, length 72, xid 0x000000ba
20:15:43.962700 IP 192.168.0.149.48692 > 192.168.0.149.6653: Flags [P.], seq 34049:34137, ack 2200, win 96, options [nop,nop,TS val 3176519 ecr 3176519], length 88: OpenFlow
	version 1.0, type FLOW_REMOVED, length 88, xid 0x00000000
20:15:43.962734 IP 192.168.0.149.6653 > 192.168.0.149.48692: Flags [.], ack 34137, win 6269, options [nop,nop,TS val 3176519 ecr 3176519], length 0
20:15:43.962764 IP 192.168.0.149.48692 > 192.168.0.149.6653: Flags [P.], seq 34137:34225, ack 2200, win 96, options [nop,nop,TS val 3176519 ecr 3176519], length 88: OpenFlow
	version 1.0, type FLOW_REMOVED, length 88, xid 0x00000000
20:15:43.962774 IP 192.168.0.149.6653 > 192.168.0.149.48692: Flags [.], ack 34225, win 6269, options [nop,nop,TS val 3176519 ecr 3176519], length 0
20:15:43.962794 IP 192.168.0.149.48692 > 192.168.0.149.6653: Flags [P.], seq 34225:34313, ack 2200, win 96, options [nop,nop,TS val 3176519 ecr 3176519], length 88: OpenFlow
	version 1.0, type FLOW_REMOVED, length 88, xid 0x00000000
20:15:43.962801 IP 192.168.0.149.6653 > 192.168.0.149.48692: Flags [.], ack 34313, win 6269, options [nop,nop,TS val 3176519 ecr 3176519], length 0
20:15:43.963562 IP 192.168.0.149.6653 > 192.168.0.149.48692: Flags [P.], seq 2200:2208, ack 34313, win 6269, options [nop,nop,TS val 3176520 ecr 3176519], length 8: OpenFlow
	version 1.0, type FLOW_MOD, length 80, xid 0x00000000
20:15:43.979784 IP 192.168.0.149.6653 > 192.168.0.149.48692: Flags [P.], seq 2288:2368, ack 34321, win 6269, options [nop,nop,TS val 3176524 ecr 3176520], length 80: OpenFlow
	version 1.0, type FLOW_MOD, length 80, xid 0x00000000
20:15:43.980011 IP 192.168.0.149.48692 > 192.168.0.149.6653: Flags [.], ack 2368, win 96, options [nop,nop,TS val 3176524 ecr 3176521], length 0
20:15:44.006136 IP 192.168.0.149.6653 > 192.168.0.149.48692: Flags [P.], seq 2368:2482, ack 34321, win 6269, options [nop,nop,TS val 3176530 ecr 3176524], length 114: OpenFlow
