	version 1.0, type FLOW_MOD, length 80, xid 0x000000a2
20:11:27.794989 IP 192.168.0.149.6653 > 192.168.0.149.48692: Flags [P.], seq 536:544, ack 1, win 6269, options [nop,nop,TS val 3112477 ecr 3112205], length 8: OpenFlow
	version 1.0, type FLOW_MOD, length 80, xid 0x000000a3
20:11:28.822033 IP 192.168.0.149.6653 > 192.168.0.149.48692: Flags [P.], seq 624:632, ack 9, win 6269, options [nop,nop,TS val 3112734 ecr 3112477], length 8: OpenFlow
	version 1.0, type FLOW_MOD, length 80, xid 0x000000a4
20:11:29.853553 IP 192.168.0.149.6653 > 192.168.0.149.48692: Flags [P.], seq 1168:1176, ack 17, win 6269, options [nop,nop,TS val 3112992 ecr 3112980], length 8: OpenFlow
	version 1.0, type FLOW_MOD, length 80, xid 0x000000a5
20:11:29.877149 IP 192.168.0.149.6653 > 192.168.0.149.48692: Flags [P.], seq 1256:1264, ack 25, win 6269, options [nop,nop,TS val 3112998 ecr 3112992], length 8: OpenFlow
	version 1.0, type FLOW_MOD, length 80, xid 0x000000a6
20:11:30.909757 IP 192.168.0.149.6653 > 192.168.0.149.48692: Flags [P.], seq 1432:1440, ack 17021, win 6269, options [nop,nop,TS val 3113256 ecr 3113162], length 8: OpenFlow
	version 1.0, type FLOW_MOD, length 80, xid 0x000000a7
20:11:31.940064 IP 192.168.0.149.6653 > 192.168.0.149.48692: Flags [P.], seq 1520:1528, ack 17029, win 6269, options [nop,nop,TS val 3113514 ecr 3113256], length 8: OpenFlow
	version 1.0, type FLOW_MOD, length 80, xid 0x000000a8
20:11:31.984430 IP 192.168.0.149.6653 > 192.168.0.149.48692: Flags [P.], seq 1608:1616, ack 17037, win 6269, options [nop,nop,TS val 3113525 ecr 3113514], length 8: OpenFlow
	version 1.0, type FLOW_MOD, length 80, xid 0x000000a9
20:11:33.020842 IP 192.168.0.149.6653 > 192.168.0.149.48692: Flags [P.], seq 2152:2160, ack 17045, win 6269, options [nop,nop,TS val 3113784 ecr 3113756], length 8: OpenFlow
	version 1.0, type FLOW_MOD, length 80, xid 0x000000aa
20:11:34.047105 IP 192.168.0.149.6653 > 192.168.0.149.48692: Flags [P.], seq 2240:2248, ack 17053, win 6269, options [nop,nop,TS val 3114040 ecr 3113784], length 8: OpenFlow
	version 1.0, type FLOW_MOD, length 80, xid 0x000000ab
20:11:34.080427 IP 192.168.0.149.6653 > 192.168.0.149.48692: Flags [P.], seq 2328:2336, ack 17061, win 6269, options [nop,nop,TS val 3114049 ecr 3114041], length 8: OpenFlow
	version 1.0, type FLOW_MOD, length 72, xid 0x000000ac
20:11:35.146126 IP 192.168.0.149.48692 > 192.168.0.149.6653: Flags [P.], seq 17069:17157, ack 2408, win 96, options [nop,nop,TS val 3114315 ecr 3114315], length 88: OpenFlow
	version 1.0, type FLOW_REMOVED, length 88, xid 0x00000000
20:11:35.146145 IP 192.168.0.149.6653 > 192.168.0.149.48692: Flags [.], ack 17157, win 6269, options [nop,nop,TS val 3114315 ecr 3114315], length 0
20:11:35.146172 IP 192.168.0.149.48692 > 192.168.0.149.6653: Flags [P.], seq 17157:17245, ack 2408, win 96, options [nop,nop,TS val 3114315 ecr 3114315], length 88: OpenFlow
	version 1.0, type FLOW_REMOVED, length 88, xid 0x00000000
20:11:35.146181 IP 192.168.0.149.6653 > 192.168.0.149.48692: Flags [.], ack 17245, win 6269, options [nop,nop,TS val 3114315 ecr 3114315], length 0
20:11:35.146289 IP 192.168.0.149.48692 > 192.168.0.149.6653: Flags [P.], seq 17245:17333, ack 2408, win 96, options [nop,nop,TS val 3114315 ecr 3114315], length 88: OpenFlow
	version 1.0, type FLOW_REMOVED, length 88, xid 0x00000000
20:11:35.146306 IP 192.168.0.149.6653 > 192.168.0.149.48692: Flags [.], ack 17333, win 6269, options [nop,nop,TS val 3114315 ecr 3114315], length 0
20:11:35.146929 IP 192.168.0.149.6653 > 192.168.0.149.48692: Flags [P.], seq 2408:2416, ack 17333, win 6269, options [nop,nop,TS val 3114315 ecr 3114315], length 8: OpenFlow
	version 1.0, type FLOW_MOD, length 80, xid 0x00000000
20:11:35.155591 IP 192.168.0.149.6653 > 192.168.0.149.48692: Flags [P.], seq 2496:2576, ack 17341, win 6269, options [nop,nop,TS val 3114318 ecr 3114315], length 80: OpenFlow
	version 1.0, type FLOW_MOD, length 80, xid 0x00000000
20:11:35.155673 IP 192.168.0.149.48692 > 192.168.0.149.6653: Flags [.], ack 2576, win 96, options [nop,nop,TS val 3114318 ecr 3114317], length 0
20:11:35.495779 IP 192.168.0.149.6653 > 192.168.0.149.48692: Flags [P.], seq 2576:2596, ack 17341, win 6269, options [nop,nop,TS val 3114403 ecr 3114318], length 20: OpenFlow
	version 1.0, type FLOW_MOD, length 72, xid 0x000000ad
20:11:35.536331 IP 192.168.0.149.48692 > 192.168.0.149.6653: Flags [P.], seq 34329:34417, ack 2736, win 96, options [nop,nop,TS val 3114413 ecr 3114413], length 88: OpenFlow
	version 1.0, type FLOW_REMOVED, length 88, xid 0x00000000
20:11:35.536381 IP 192.168.0.149.48692 > 192.168.0.149.6653: Flags [P.], seq 34417:34505, ack 2736, win 96, options [nop,nop,TS val 3114413 ecr 3114413], length 88: OpenFlow
	version 1.0, type FLOW_REMOVED, length 88, xid 0x00000000
20:11:35.537454 IP 192.168.0.149.6653 > 192.168.0.149.48692: Flags [P.], seq 2736:2744, ack 34505, win 6269, options [nop,nop,TS val 3114413 ecr 3114413], length 8: OpenFlow
	version 1.0, type FLOW_MOD, length 80, xid 0x00000000
20:11:35.579577 IP 192.168.0.149.48692 > 192.168.0.149.6653: Flags [.], ack 2824, win 96, options [nop,nop,TS val 3114424 ecr 3114414], length 0
20:11:36.005172 IP 192.168.0.149.6653 > 192.168.0.149.48692: Flags [P.], seq 2824:2938, ack 34513, win 6269, options [nop,nop,TS val 3114530 ecr 3114424], length 114: OpenFlow
